Ontario Trillium Foundation ,Canada,Ontario,2016-2017,Youth Opportunities Fund ,Toronto,No,2Y16170011577,Rainbow's Pride in Scarborough (RPIS) c/o SKETCH Working Arts for Street-involved and Homeless Youth,9/28/2016,3/30/2017,89227,97200,36,"Delivering a project that builds on the success of a proven model or program with a $97,200 over 36 months to offer costume design workshops and Pride events for queer and trans youth with disabilities in Scarborough. Leadership opportunities will also be offered to engage the youth in their community.",Réaliser un projet qui repose sur un modèle ou un programme éprouvé grâce à une subvention de 97 200 $ échelonnée sur 36 mois afin d'offrir des ateliers de conception de costumes et des activités axées sur la fierté aux jeunes queer et trans ayant un handicap à Scarborough. On offrira également aux jeunes des possibilités de leadership afin de les mobiliser dans leur communauté.,Grassroots Innovation - Scale,,85912 8332 RR0001,North York,M3J 3J6,Yes,"Black/Afro-diasporic/Afro-Caribbean and/or Afro-Latinx youth;Racialized youth (other than Black youth);Lesbian, gay, bi-sexual, transgender, two-spirit, queer (LGBTTQ+) youth;Newcomer youth;Youth at-risk of dropping out or have dropped out of school;Youth in care or leaving care;Youth in low-income situations or from low-income families;Youth living with disabilities or special needs between the ages of 12 to 29;Youth vulnerable of becoming or are in conflict with the law",15 to 19 years;20 to 25 years;12 to 29 years for youth with special needs or disabilities,Youth are enaged in their community,3/5/2020 0:00
Ontario Trillium Foundation ,Canada,Ontario,2016-2017,Youth Opportunities Fund ,Champlain,No,2Y16170011150,Refuge Zone c/o Assunah Muslim Association,9/28/2016,3/30/2017,210000,201200,36,"Delivering a project at the idea or conceptual stage with a grant of $201,200 over 36 months to organize weekly opportunities for newcomer Syrian youth to meet in a safe setting, build relationships, integrate into society using their first language, and become engaged in the community.","Réaliser un projet qui en est au stade de l'idée ou de la conception grâce à une subvention de 201 200 $ échelonnée sur 36 mois afin que de jeunes Syriens nouvellement arrivés puissent se rencontrer toutes les semaines dans un endroit sûr, nouer des relations, s'intégrer à la société en utilisant leur langue maternelle et jouer un rôle actif dans la communauté.",Grassroots Innovation - Test - ON 150,,863858494RR0001,Ottawa,K1T 3P1,Yes,Newcomer youth;Racialized youth (other than Black youth);Youth at-risk of dropping out or have dropped out of school;Youth in low-income situations or from low-income families;Youth vulnerable of becoming or are in conflict with the law,12 to 14 years;15 to 19 years;20 to 25 years;12 to 29 years for youth with special needs or disabilities;Parents or gaurdians of young people,Youth are enaged in their community,3/5/2020 0:00
Ontario Trillium Foundation ,Canada,Ontario,2016-2017,Youth Opportunities Fund ,"Algoma, Cochrane, Manitoulin, Sudbury",No,2Y16170011131,Refugee705 c/o Sault Community Information and Career Centre Inc,9/28/2016,3/30/2017,117226,122100,24,"Delivering a project at the idea or conceptual stage with a $122,100 over 24 months to facilitate activities that promote, strong, healthy and cross-cultural relationships between refugees and Canadian-born youth and adults in Sault Ste. Marie. The initiative will help newcomer youth integrate successfully into their new community. ",Réaliser un projet qui en est au stade de l'idée ou de la conception grâce à une subvention de 122 100 $ échelonnée sur 24 mois afin d'offrir des activités qui aident les réfugiés ainsi que les jeunes et les adultes nés au Canada à nouer des relations interculturelles saines et solides entre eux à Sault Ste. Marie. Ce projet aidera les jeunes nouveaux arrivants à s'intégrer à leur nouvelle communauté.,Grassroots Innovation - Test,965336,,Sault Ste Marie,P6A 5K8,Yes,Newcomer youth;Youth in low-income situations or from low-income families;Youth living in rural or remote communities,12 to 14 years;15 to 19 years;Parents or gaurdians of young people,"Youth form and maintain healthy, close relationships",3/5/2020 0:00
Ontario Trillium Foundation ,Canada,Ontario,2016-2017,Youth Opportunities Fund ,Toronto,No,2Y16170011295,Remembered Voices c/o SKETCH Working Arts for Street-involved and Homeless Youth,9/28/2016,3/30/2017,400000,400000,48,"Delivering a project that builds on the success of a proven model or program with a $400,000 grant over 48 months to expand a drop-in program, focusing on youth and enhancing programs to include Traditional Teachings for 2Spirit/LGBTTQ Indigenous youth in Toronto. The initiative will help youth develop leadership and life-building skills, while strengthening a sense of community and belonging. ","Réaliser un projet qui repose sur un modèle ou un programme éprouvé grâce à une subvention de 400 000 $ échelonnée sur 48 mois afin d'élargir un programme d'accueil des jeunes et d'améliorer d'autres programmes, y compris un programme d'enseignements traditionnels destinés aux jeunes autochtones bispirituels ou LGBTBQ à Toronto. Cette initiative aidera les jeunes à développer leurs capacités de leadership et les habiletés leur permettant de construire leur vie, tout en renforçant leur sentiment d'appartenance à la communauté.",Grassroots Innovation - Scale,,85912 8332 RR0001,Toronto,M6C 1A3,Yes,"Indigenous youth (i.e. First Nations, Métis or Inuit youth);Lesbian, gay, bi-sexual, transgender, two-spirit, queer (LGBTTQ+) youth;Youth at-risk of dropping out or have dropped out of school;Youth in low-income situations or from low-income families;Youth vulnerable of becoming or are in conflict with the law",12 to 14 years;15 to 19 years;20 to 25 years,"Youth form and maintain healthy, close relationships",3/5/2020 0:00
Ontario Trillium Foundation ,Canada,Ontario,2016-2017,Youth Opportunities Fund ,Halton Peel,No,2Y16170011328,Resiliency 4 Recovery c/o Community Development Halton,9/28/2016,3/30/2017,140000,140000,24,"Delivering a project at the idea or conceptual stage with a grant of $140,000 over 24 months to host weekly peer support meetings and community engagement opportunities for youth with mental health or addictions concerns in Oakville. It will give youth access to tools and resources supporting personal development and provide opportunities to lead initiatives in support of the community, such as overdose awareness campaigns and gardening programs. ","Réaliser un projet qui en est au stade de l'idée ou de la conception grâce à une subvention de 140 000 $ échelonnée sur 24 mois afin d'organiser des séances hebdomadaires de soutien par les pairs et des activités de participation communautaires pour les jeunes ayant des problèmes de toxicomanie ou de santé mentale à Oakville. Ainsi, les jeunes pourront accéder à des outils et à des ressources favorisant leur développement et diriger des initiatives de soutien dans la communauté comme des campagnes de sensibilisation aux surdoses et des programmes de jardinage.",Grassroots Innovation - Test,575450,107462525RR0001,Oakville,L6M 3Y4,Yes,Youth in low-income situations or from low-income families;Youth living with disabilities or special needs between the ages of 12 to 29,19 to 25 years;12 to 29 years for youth with special needs or disabilities,"Youth form and maintain healthy, close relationships",3/5/2020 0:00
Ontario Trillium Foundation ,Canada,Ontario,2016-2017,Youth Opportunities Fund ,Toronto,No,2Y16170011056,RISE Edutainment c/o VIBE Arts,9/28/2016,3/30/2017,300000,300000,36,"Delivering a project that builds on the success of a proven model or program with a grant of $300,000 over 36 months to expand on weekly artistic gatherings, as well as continuing its annual celebration and conferences for racialized youth in Toronto. These events provide a welcoming, supportive and positive space for young people and artists in the community.",Réaliser un projet qui repose sur un modèle ou un programme éprouvé grâce à une subvention de 300 000 $ échelonnée sur 36 mois afin d'offrir un plus grand nombre de rencontres artistiques hebdomadaires et de poursuivre la célébration et la conférence annuelles organisées pour les jeunes racialisés à Toronto. Ces activités offrent un endroit accueillant et positif où les jeunes et les artistes de la communauté se sentent soutenus.,Grassroots Innovation - Scale,739341,897960456RR0001,Scarborough,M1B 6G5,Yes,Black/Afro-diasporic/Afro-Caribbean and/or Afro-Latinx youth;Racialized youth (other than Black youth);Youth in low-income situations or from low-income families;Youth vulnerable of becoming or are in conflict with the law,15 to 19 years;20 to 25 years;Parents or gaurdians of young people,Youth know about and easily navigate resources and opportunities in their communities,3/5/2020 0:00
Ontario Trillium Foundation ,Canada,Ontario,2016-2017,Youth Opportunities Fund ,Hamilton,No,2Y16170011235,speqtrum hamilton c/o YWCA Hamilton,9/28/2016,3/30/2017,210000,210000,36,"Delivering a project at the idea or conceptual stage with a grant of $210,000 over 36 months to host biweekly meetups (one active and one social), as well as monthly skill sharing and mentorship workshops for trans and queer youth aged 15-25 in Hamilton.",Réaliser un projet qui en est au stade de l'idée ou de la conception grâce à une subvention de 210 000 $ échelonnée sur 36 mois afin d'organiser des rencontres bimensuelles (une rencontre active et une activité sociale) et des ateliers mensuels de partage des compétences et de mentorat pour les jeunes trans et queer âgés de 15 à 25 ans à Hamilton.,Grassroots Innovation - Test,5143,119236792RR0001,Hamilton,L8M 1P8,Yes,"Lesbian, gay, bi-sexual, transgender, two-spirit, queer (LGBTTQ+) youth;Youth at-risk of dropping out or have dropped out of school;Youth in low-income situations or from low-income families",15 to 19 years;20 to 25 years,"Youth form and maintain healthy, close relationships",3/5/2020 0:00
Ontario Trillium Foundation ,Canada,Ontario,2016-2017,Youth Opportunities Fund ,Northwestern,No,2Y16170011038,St. Joseph's Care Group,9/28/2016,3/30/2017,882000,882500,48,"With a grant of $882,000 over 48 months, this collaborative initiative will improve the system of care to detect psychosis symptoms early, and access appropriate services for youth with psychosis who live in Northwestern Ontario. The collaborative initiative will increase connections between sectors, redesign existing resource tools, increase the availability and capacity of service providers, improving the pathways for youth who experience psychosis.","Grâce à une subvention de 882 000 $ échelonnée sur 48 mois, cette initiative de collaboration améliorera le système de soins afin que l'on puisse détecter rapidement les symptômes de la psychose et que les jeunes du Nord-Ouest de l'Ontario souffrant de cette maladie puissent accéder aux services dont ils ont besoin. Cette initiative de collaboration renforcera les liens entre les secteurs et permettra de repenser les ressources offertes, d'offrir un plus grand nombre de services et de renforcer les capacités des fournisseurs de services, ce qui améliorera le cheminement des jeunes aux prises avec une psychose.",Strategic Collaboration,336624,119183267,Thunder Bay,P7B 5G4,No,"Indigenous youth (i.e. First Nations, Métis or Inuit youth);Youth at-risk of dropping out or have dropped out of school;Youth in care or leaving care;Youth in low-income situations or from low-income families;Youth living in rural or remote communities;Youth living with disabilities or special needs between the ages of 12 to 29;Youth vulnerable of becoming or are in conflict with the law",12 to 29 years for youth with special needs or disabilities,Youth know about and easily navigate resources and opportunities in their communities,3/5/2020 0:00
Ontario Trillium Foundation ,Canada,Ontario,2016-2017,Youth Opportunities Fund ,Toronto,No,2Y16170010985,The Film Stars Project c/o The Canadian Training Institute,9/28/2016,3/30/2017,300000,300000,36,"Delivering a project that builds on the success of a proven model or program with a grant of $300,000 over 36 months to deliver film and media training programs focusing on technical, creative and teamwork skills for racialized youth in the Jane/Finch and Rexdale communities.","Réaliser un projet qui repose sur un modèle ou un programme éprouvé grâce à une subvention de 300 000 $ échelonnée sur 36 mois afin d'offrir aux jeunes racialisés des communautés de Jane/Finch et de Rexdale des programmes de formation en cinéma et d'étude des médias qui mettent l'accent sur les compétences techniques, la création et le travail d'équipe. ",Grassroots Innovation - Scale,1684698,886605997RR0001,Toronto,M5V 3H5,Yes,Black/Afro-diasporic/Afro-Caribbean and/or Afro-Latinx youth;Youth at-risk of dropping out or have dropped out of school;Youth in low-income situations or from low-income families;Youth vulnerable of becoming or are in conflict with the law,12 to 14 years;15 to 19 years;20 to 25 years,Youth know about and easily navigate resources and opportunities in their communities,3/5/2020 0:00
Ontario Trillium Foundation ,Canada,Ontario,2016-2017,Youth Opportunities Fund ,Toronto,No,2Y16170011297,Toolbox c/o SKETCH Working Arts for Street-involved and Homeless Youth,9/28/2016,3/30/2017,210000,210000,36,"Delivering a project at the idea or conceptual stage with a grant of $210,000 over 36 months to deliver a multi-dimensional trades mentorship and training program to LGBTTQ+ youth in Scarborough. It will utilize a diverse, gendered perspective to create a trades work curriculum, teaching tangible and creative skills in woodworking, bike mechanics and electronics, while enabling youth to foster and maintain healthy, close relationships.","Réaliser un projet qui en est au stade de l'idée ou de la conception grâce à une subvention de 210 000 $ échelonnée sur 36 mois afin d'offrir un programme de formation et de mentorat à plusieurs facettes dans le domaine des métiers aux jeunes LGBTBQ+ à Scarborough. Ce programme fera appel à une approche variée et à une perspective axée sur le genre pour créer un programme d'enseignement pratique et créatif dans les domaines du travail du bois, de la réparation des vélos et de l'électronique, tout en aidant les jeunes à nouer et à maintenir des relations étroites saines.",Grassroots Innovation - Test,,85912 8332 RR0001,Toronto,M2N 2W6,Yes,"Lesbian, gay, bi-sexual, transgender, two-spirit, queer (LGBTTQ+) youth;Newcomer youth;Racialized youth (other than Black youth);Youth in low-income situations or from low-income families",15 to 19 years;20 to 25 years,"Youth form and maintain healthy, close relationships",3/5/2020 0:00
Ontario Trillium Foundation ,Canada,Ontario,2016-2017,Youth Opportunities Fund ,Toronto,No,2Y16170011211,Toronto Kiwanis Boys and Girls Clubs,9/28/2016,3/30/2017,749795,749900,60,"With a grant of $749,900 over 60 months, this collaborative initiative will improve the system of supports in Toronto for young people in conflict with the law. It will improve the effectiveness of targeted reintegration supports and reduce recidivism through enhanced community partnerships, communications, improved knowledge and understanding of current services, collaborative case planning, and increased youth and community stakeholder involvement. ","Grâce à une subvention de 749 900 $ échelonnée sur 60 mois, cette initiative de collaboration améliorera les soutiens offerts à Toronto aux jeunes ayant des démêlés avec la justice. Elle rendra les programmes ciblés de soutien à la réintégration plus efficaces et réduira la récidive en améliorant les partenariats communautaires, les communications, les connaissances et la compréhension des services actuels, en misant sur la collaboration pour planifier la gestion des cas et en aidant les jeunes et les parties prenantes communautaires à jouer un rôle accru.",Strategic Collaboration,,107573149RR0001,Toronto,M5A2J3,No,Black/Afro-diasporic/Afro-Caribbean and/or Afro-Latinx youth;Racialized youth (other than Black youth);Newcomer youth;Youth at-risk of dropping out or have dropped out of school;Youth vulnerable of becoming or are in conflict with the law,12 to 14 years;15 to 19 years,Youth know about and easily navigate resources and opportunities in their communities,3/5/2020 0:00
Ontario Trillium Foundation ,Canada,Ontario,2016-2017,Youth Opportunities Fund ,"Durham, Haliburton, Kawartha, Pine Ridge",No,2Y16170011483,TRACKS Youth Program c/o Kawartha World Issues Centre (KWIC),9/28/2016,3/30/2017,398976,399200,48,"Delivering a project that builds on the success of a proven model or program with a grant of $399,200 over 48 months to engage Indigenous youth leaders aged 14-18 to foster relationship-building and mentorship between youth and adult role models in First Nations and urban Indigenous organizations within Peterborough and the Kawarthas.",Réaliser un projet qui repose sur un modèle ou un programme éprouvé grâce à une subvention de 399 200 $ échelonnée sur 48 mois afin d'aider les jeunes leaders autochtones âgés de 14 à 18 ans à renforcer les liens entre les jeunes et les adultes qui peuvent servir de modèles de comportement et à favoriser le mentorat au sein des Premières Nations et des organisations autochtones en milieu urbain à Peterborough et dans les Kawarthas.,Grassroots Innovation - Scale,,140416884RR0001,Peterborough,K9J 7B8,Yes,"Indigenous youth (i.e. First Nations, Métis or Inuit youth);Youth at-risk of dropping out or have dropped out of school;Youth in care or leaving care;Youth in low-income situations or from low-income families;Youth living in rural or remote communities;Youth vulnerable of becoming or are in conflict with the law",12 to 14 years;15 to 19 years;20 to 25 years,"Youth have at least one consistent, caring person in their lives",3/5/2020 0:00
Ontario Trillium Foundation ,Canada,Ontario,2016-2017,Youth Opportunities Fund ,"Algoma, Cochrane, Manitoulin, Sudbury",No,2Y16170011227,Transgender Social Support Services Inc c/o Sudbury Action Centre for Youth,9/28/2016,3/30/2017,400000,400000,48,"Delivering a project that builds on the success of a proven model or program with a grant of $400,000 over 48 months to assist transgender youth in accessing services in their communities. It will provide training to youth-serving organizations, teachers, and schools in transgender sensitivity, making Northeastern Ontario communities safer for transgender youth. ","Réaliser un projet qui repose sur un modèle ou un programme éprouvé grâce à une subvention de 400 000 $ échelonnée sur 48 mois afin d'aider les jeunes transgenres à se prévaloir des services offerts dans leur communauté. Dans le cadre de ce projet, une formation sera offerte aux organismes qui servent les jeunes, au personnel enseignant et aux écoles pour les sensibiliser aux besoins des personnes transgenres, ce qui rendra les communautés du Nord-Est de l'Ontario plus sûres pour les jeunes transgenres.",Grassroots Innovation - Scale,691708,88808-5644-RP0001,Sudbury,P3C 1T3,Yes,"Lesbian, gay, bi-sexual, transgender, two-spirit, queer (LGBTTQ+) youth;Youth at-risk of dropping out or have dropped out of school;Youth in care or leaving care;Youth in low-income situations or from low-income families;Youth living in rural or remote communities;Youth vulnerable of becoming or are in conflict with the law",12 to 14 years;15 to 19 years;20 to 25 years;12 to 29 years for youth with special needs or disabilities;Parents or guardians of young people,Youth know about and easily navigate resources and opportunities in their communities,3/5/2020 0:00
Ontario Trillium Foundation ,Canada,Ontario,2016-2017,Youth Opportunities Fund ,Simcoe York,No,2Y16170011162,York Region Gay Straight Alliance North c/o York Pride Fest,9/28/2016,3/30/2017,181080,203100,36,"Delivering a project that builds on the success of a proven model or program with a $203,100 grant over 36 months to create a safe space, providing peer support, interactive programming and volunteer opportunities for York Region youth who identify as LGBTTQ. The programs will give youth an opportunity to build on their self-esteem and confidence levels.","Réaliser un projet qui repose sur un modèle ou un programme éprouvé grâce à une subvention de 203 100 $ échelonnée sur 36 mois afin de créer un endroit sûr où les jeunes de la région de York qui s'identifient comme étant LGBTBQ peuvent recevoir du soutien de leurs camarades, se prévaloir de programmes interactifs et faire du bénévolat. Ce projet permettra aux jeunes de développer leur estime de soi et leur confiance en eux.",Grassroots Innovation - Scale,939732-9,,Newmarket,L3Y 3V8,Yes,"Lesbian, gay, bi-sexual, transgender, two-spirit, queer (LGBTTQ+) youth;Youth at-risk of dropping out or have dropped out of school;Youth in low-income situations or from low-income families;Youth living in rural or remote communities",15 to 19 years;20 to 25 years,Youth know about and easily navigate resources and opportunities in their communities,3/5/2020 0:00
Ontario Trillium Foundation ,Canada,Ontario,2016-2017,Youth Opportunities Fund ,Toronto;Simcoe York,Yes,2Y16170011147,Young Women's Leadership Network c/o YWCA Toronto,9/28/2016,3/30/2017,110000,76500,24,"Delivering a project at the idea or conceptual stage with a grant of $76,500 over 24 months to organize and deliver in-person and online educational activities for racialized and newcomer young women in Toronto and York Region. It will provide encouragement and a sense of empowerment to engage in their communities and the political process.","Réaliser un projet qui en est au stade de l'idée ou de la conception grâce à une subvention de 76 500 $ échelonnée sur 24 mois afin d'organiser et d'offrir des activités éducatives en personne et en ligne aux jeunes racialisées et nouvelles arrivantes à Toronto et dans la région de York. Ce projet encouragera les participantes à jouer un rôle actif dans leur communauté et la sphère politique, et leur donnera les moyens d'y parvenir.",Grassroots Innovation - Test,,108229865RR0001,Newmarket,L3X 2C3,Yes,"Black/Afro-diasporic/Afro-Caribbean and/or Afro-Latinx youth;Racialized youth (other than Black youth);Indigenous youth (i.e. First Nations, Métis or Inuit youth);Lesbian, gay, bi-sexual, transgender, two-spirit, queer (LGBTTQ+) youth;Newcomer youth;Youth in low-income situations or from low-income families;Youth living with disabilities or special needs between the ages of 12 to 29",15 to 19 years;20 to 25 years,Youth are enaged in their community,3/5/2020 0:00
Ontario Trillium Foundation ,Canada,Ontario,2016-2017,Youth Opportunities Fund ,"Waterloo, Wellington, Dufferin",No,2Y16170010992,"Youth to Youth - A friend to count on c/o Langs Farm Village Association, Cambridge",9/28/2016,3/30/2017,67000,100200,36,"Delivering a project at the idea or conceptual stage with a grant of $100,200 over 36 months to provide a support system for newcomer youth with Canadian-born peers and community. Young people will develop their English and communication skills through English Conversations Circles, social evenings and excursions to libraries, community centres and parks.","Réaliser un projet qui en est au stade de l'idée ou de la conception grâce à une subvention de 100 200 $ échelonnée sur 36 mois afin de permettre à de jeunes Canadiens et d'autres membres de la communauté d'offrir des services de soutien à de jeunes nouveaux arrivants. Ces derniers pourront ainsi améliorer leurs connaissances de l'anglais et leurs habiletés de communication en participant à des cercles de conversation anglaise, à des soirées sociales et à des visites de bibliothèques, de centres communautaires et de parcs. ",Grassroots Innovation - Test - ON 150,,107596306RR0001,Cambridge,N1T 1V8,Yes,Newcomer youth;Racialized youth (other than Black youth);Youth at-risk of dropping out or have dropped out of school;Youth in low-income situations or from low-income families,12 to 14 years;15 to 19 years,"Youth form and maintain healthy, close relationships",3/5/2020 0:00
